{"$schema":"https://json-schema.org/draft/2020-12/schema","title":"Vehicle RAG Corpus V1","type":"object","additionalProperties":false,"required":["schemaVersion","bundleId","bundleVersion","knowledgeScopeId","scope","documents"],"properties":{"schemaVersion":{"const":1},"bundleId":{"type":"string","minLength":1},"bundleVersion":{"type":"string","minLength":1},"knowledgeScopeId":{"type":"string","minLength":1},"scope":{"$ref":"#/$defs/scope"},"documents":{"type":"array","items":{"type":"object","additionalProperties":false,"required":["documentId","title","documentType","documentVersion","language","sourceFormat","relativePath","expectedSha256","applicability"],"properties":{"documentId":{"type":"string"},"title":{"type":"string"},"documentType":{"type":"string"},"documentVersion":{"type":"string"},"language":{"type":"string"},"sourceFormat":{"enum":["PDF","STATIC_HTML","MARKDOWN"]},"relativePath":{"type":"string"},"expectedSha256":{"pattern":"^[0-9a-f]{64}$"},"applicability":{"$ref":"#/$defs/scope"}}}}},"$defs":{"scope":{"type":"object","additionalProperties":false,"required":["vehicleModel","modelYear","region","softwareVersion","configurationCode"],"properties":{"vehicleModel":{"type":"string"},"modelYear":{"type":"string"},"region":{"type":"string"},"softwareVersion":{"type":"string"},"configurationCode":{"type":"string"}}}}}
