{"schemaVersion":1,"bundleId":"demo-vehicle-knowledge","bundleVersion":"TEST_ONLY-v1","knowledgeScopeId":"demo-model-2026-cn-demo-version-default","scope":{"vehicleModel":"DEMO_MODEL","modelYear":"2026","region":"CN","softwareVersion":"DEMO_VERSION","configurationCode":"DEFAULT"},"documents":[{"documentId":"demo-markdown","title":"TEST_ONLY 示例","documentType":"OWNER_MANUAL","documentVersion":"TEST_ONLY-v1","language":"zh-CN","sourceFormat":"MARKDOWN","relativePath":"documents/demo.md","expectedSha256":"aaaaaaaaaaaaaaaaaaaaaaaaaaaaaaaaaaaaaaaaaaaaaaaaaaaaaaaaaaaaaaaa","applicability":{"vehicleModel":"*","modelYear":"*","region":"*","softwareVersion":"*","configurationCode":"*"}}]}
